{
  "$schema": "../../docs/spec/colony-v1.json",
  "name": "cli-tool",
  "version": "0.1.0",
  "description": "Reference colony for a cross-platform CLI project (shipctl persona). Demonstrates SkDD skills for release pipelines, build matrices, flag management, man page generation, and breaking-change audits.",
  "spec": "agentskills.io/v1",
  "canonicalSkillsDir": "skills",
  "harnessMirrors": [],
  "skills": [
    {
      "name": "release-cut",
      "path": "skills/release-cut/SKILL.md",
      "description": "Cut a versioned release: bump version, generate changelog, tag, and draft GitHub release.",
      "status": "active"
    },
    {
      "name": "cross-compile-matrix",
      "path": "skills/cross-compile-matrix/SKILL.md",
      "description": "Add a new target triple to the cross-platform build matrix.",
      "status": "active"
    },
    {
      "name": "flag-add",
      "path": "skills/flag-add/SKILL.md",
      "description": "Add a CLI flag end-to-end: parser, help text, completions, docs, and tests.",
      "status": "active"
    },
    {
      "name": "manpage-sync",
      "path": "skills/manpage-sync/SKILL.md",
      "description": "Regenerate man pages and shell completions when commands change.",
      "status": "active"
    },
    {
      "name": "breaking-change-audit",
      "path": "skills/breaking-change-audit/SKILL.md",
      "description": "Pre-release audit of public flags, exit codes, and output formats vs the last tag.",
      "status": "active"
    }
  ],
  "homepage": "https://github.com/zakelfassi/skills-driven-development/tree/main/examples/cli-tool",
  "repository": {
    "type": "git",
    "url": "https://github.com/zakelfassi/skills-driven-development.git",
    "directory": "examples/cli-tool"
  },
  "license": "MIT",
  "maintainers": [
    {
      "name": "Zak El Fassi",
      "github": "zakelfassi"
    }
  ],
  "keywords": [
    "cli",
    "rust",
    "cross-compile",
    "release",
    "skdd",
    "skills-driven-development"
  ]
}
