{
  "$schema": "./docs/spec/colony-v1.json",
  "name": "skills-driven-development",
  "version": "1.0.0",
  "description": "The seed colony for Skills-Driven Development — the skillforge meta-skill, methodology docs, a canonical-skills/ pattern CLI, and three reference example colonies (webapp-starter, cli-tool, data-pipeline).",
  "spec": "agentskills.io/v1",
  "canonicalSkillsDir": "skillforge",
  "harnessMirrors": [],
  "skills": [
    {
      "name": "skillforge",
      "path": "skillforge/SKILL.md",
      "description": "Create or update a reusable agent skill. Use when you notice a repeated pattern, when a workflow should be persisted for future sessions, or when asked to forge/create/scaffold a new skill.",
      "status": "active"
    }
  ],
  "examples": [
    {
      "name": "webapp-starter",
      "path": "examples/webapp-starter",
      "description": "Reference colony for a React + TypeScript + Express web application. Demonstrates SkDD skills for component scaffolding, API endpoint generation, deploy-preview automation, and bug triage.",
      "skills": [
        "examples/webapp-starter/skills/deploy-preview/SKILL.md",
        "examples/webapp-starter/skills/component-scaffold/SKILL.md",
        "examples/webapp-starter/skills/api-endpoint/SKILL.md",
        "examples/webapp-starter/skills/bug-triage/SKILL.md"
      ]
    },
    {
      "name": "cli-tool",
      "path": "examples/cli-tool",
      "description": "Reference colony for a cross-platform CLI project (shipctl persona). Demonstrates SkDD skills for release pipelines, build matrices, flag management, man page generation, and breaking-change audits.",
      "skills": [
        "examples/cli-tool/skills/release-cut/SKILL.md",
        "examples/cli-tool/skills/cross-compile-matrix/SKILL.md",
        "examples/cli-tool/skills/flag-add/SKILL.md",
        "examples/cli-tool/skills/manpage-sync/SKILL.md",
        "examples/cli-tool/skills/breaking-change-audit/SKILL.md"
      ]
    },
    {
      "name": "data-pipeline",
      "path": "examples/data-pipeline",
      "description": "Reference colony for a Python data-engineering and ML project. Demonstrates SkDD skills for dataset onboarding, ETL pipeline scaffolding, experiment logging, data quality gates, and safe historical backfills.",
      "skills": [
        "examples/data-pipeline/skills/dataset-onboard/SKILL.md",
        "examples/data-pipeline/skills/pipeline-stage/SKILL.md",
        "examples/data-pipeline/skills/experiment-log/SKILL.md",
        "examples/data-pipeline/skills/data-quality-gate/SKILL.md",
        "examples/data-pipeline/skills/backfill-runbook/SKILL.md"
      ]
    }
  ],
  "homepage": "https://github.com/zakelfassi/skills-driven-development",
  "repository": {
    "type": "git",
    "url": "https://github.com/zakelfassi/skills-driven-development.git"
  },
  "license": "MIT",
  "maintainers": [
    {
      "name": "Zak El Fassi",
      "github": "zakelfassi"
    }
  ],
  "cli": {
    "package": "@zakelfassi/skdd",
    "path": "cli"
  },
  "plugins": [
    {
      "name": "skdd-claude",
      "path": "plugins/skdd-claude",
      "target": "claude-code"
    }
  ],
  "keywords": [
    "skills-driven-development",
    "skdd",
    "agent-skills",
    "agentskills.io",
    "skillforge",
    "skill-colony",
    "claude-code",
    "codex",
    "cursor",
    "copilot"
  ]
}
